<?xml version="1.0" encoding="UTF-8"?>
<authority xmlns:xsi="http://www.w3.org/2001/XMLSchema-instance" xsi:noNamespaceSchemaLocation="authority.xsd"
		code="ESA" name="European Space Agency" corporation="false"
					agenda="Surface Operations" gender-ratio="0.48">
			<country name="Austria"/>
			<country name="Belgium"/>
			<country name="Czech Republic"/>
			<country name="Denmark"/>
			<country name="Estonia"/>
			<country name="Finland"/>
			<country name="France"/>
			<country name="Germany"/>
			<country name="Greece"/>
			<country name="Hungary"/>
			<country name="Ireland"/>
			<country name="Italy"/>
			<country name="Luxembourg"/>
			<country name="Netherlands"/>
			<country name="Norway"/>
			<country name="Poland"/>
			<country name="Portugal"/>
			<country name="Romania"/>
			<country name="Spain"/>
			<country name="Sweden"/>
			<country name="Switzerland"/>
			<country name="United Kingdom"/>
			<settlement-name name="Base Visage" />
			<settlement-name name="Base Gaia" />
			<settlement-name name="Station Mere" />
			<settlement-name name="Neu Braunfels" />
			<settlement-name name="Nieuw Amsterdam" />
			<settlement-name name="New Paris" />
			<settlement-name name="New Berlin" />
			<settlement-name name="New Athen" />
			<settlement-name name="New Brussels" />
			<settlement-name name="New Madrid" />
			<settlement-name name="New Copenhagen" />
			<settlement-name name="New Rome" />
			<settlement-name name="Europa" />

			<rover-name name="al-Mirrikh" /> <!-- Arabic/Persian for "Mars" -->
			<rover-name name="Areos Aster" /> <!-- Greek for "star of Ares" -->
			<rover-name name="Ariane" />
			<rover-name name="Beagle IV" />
			<rover-name name="Bedouin" />
			<rover-name name="Blodstjarna" /> <!-- Viking for "Mars" (not certain) -->
			<rover-name name="Bahram" /> <!-- Ancient Persian for "Mars" -->

			<rover-name name="Autobahn" />	<!-- German for Motorway  -->
			<rover-name name="Fahrzeug" />	<!-- German for vehicle -->
	 		<rover-name name="Gaspedal" />	<!-- German for Accelerator  -->
			<rover-name name="Gondel" />		<!-- German for gondola -->
			<rover-name name="Kutsche" />	<!-- German for carriage -->
	 		<rover-name name="Schlitten" />	<!-- German for carriage -->

			<rover-name name="Nergal" />     <!-- Babylonian for "Mars" -->

			<rover-name name="Merih" />      <!-- Turkish for "Mars" -->
			<rover-name name="Sakit" />      <!-- Ancient Turkish for "Mars" -->

			<rover-name name="Voiture" />	<!-- French for vehicle -->
		</authority>
