<?xml version="1.0" encoding="UTF-8"?>
<authority xmlns:xsi="http://www.w3.org/2001/XMLSchema-instance" xsi:noNamespaceSchemaLocation="authority.xsd"
		code="MS" name="Mars Society" corporation="true"
					agenda="Settling Mars" gender-ratio="0.5">
			<country name="Austria"/>
			<country name="Belgium"/>			
			<country name="Canada"/>
			<country name="China"/>
			<country name="Czech Republic"/>
			<country name="Denmark"/>
			<country name="Estonia"/>
			<country name="Finland"/>
			<country name="France"/>
			<country name="Germany"/>
			<country name="Greece"/>
			<country name="Hungary"/>
			<country name="India"/>
			<country name="Ireland"/>
			<country name="Italy"/>
			<country name="Japan"/>
			<country name="Luxembourg"/>
			<country name="Netherlands"/>
			<country name="Norway"/>
			<country name="Poland"/>
			<country name="Portugal"/>
			<country name="Romania"/>
			<country name="Russia"/>
			<country name="Spain"/>
			<country name="Sweden"/>
			<country name="Switzerland"/>
			<country name="United Kingdom"/>
			<country name="United States"/>
			<country name="Brazil"/>
			<country name="Saudi Arabia"/>
			<country name="South Korea"/>
			<country name="Taiwan"/>
			<country name="United Arab Emirates"/>
			<settlement-name name="New Cairo" />
			<settlement-name name="New Boulder" />
			<settlement-name name="Burroughsburg" />
			<settlement-name name="Zubrin City" />
			<settlement-name name="Clarketown" />
			<settlement-name name="Sojourner Station" />
			<settlement-name name="Viking Base" />
			<settlement-name name="Camp Bradbury" />
			<settlement-name name="Camp Wells" />
			<settlement-name name="Heinlein" />
			<settlement-name name="Port Kokh" />
			<settlement-name name="Port Lowell" />			
			<settlement-name name="Heinlein" />
			<settlement-name name="Burroughs" />
			<settlement-name name="Robinson" />
			<settlement-name name="Hartmann Base" />
			<settlement-name name="Shoemaker" />
			<rover-name name="Dusty Star" />
			<rover-name name="Dust Storm" />
			<rover-name name="Dust Sprite" />
			<rover-name name="Dust Bowl" />
			<rover-name name="Martian Escape" />
			<rover-name name="Martian Cloud" />
			<rover-name name="Ma'adim" /> <!-- Hebrew for "Mars" -->
			<rover-name name="Red Mariner" />
			<rover-name name="Red Moon" />
			<rover-name name="Ridge Runner" />
			<rover-name name="Shooting Star" />
			<rover-name name="Sand Dancer" />
			<rover-name name="Spice Trader" />
			<rover-name name="Solitude" />
			<rover-name name="Sand Spirit" />
			<rover-name name="Sand Crawler" />
			<rover-name name="Sojourner II" />
			<rover-name name="Spirit II" />
			<rover-name name="Sun Dancer" />
			<rover-name name="Wind Runner" />
			<rover-name name="Windstorm" />
			<rover-name name="Desert Fox" />
		</authority>
